{
  "$schema": "https://json-schema.org/draft/2020-12/schema",
  "$id": "https://witnessops.example/schemas/objects/ScopeDraft.schema.json",
  "title": "ScopeDraft",
  "type": "object",
  "additionalProperties": false,
  "required": [
    "scope_id",
    "claim_id",
    "seed_domain",
    "scope_mode",
    "methods",
    "exclusions",
    "time_window",
    "jurisdiction",
    "status"
  ],
  "properties": {
    "scope_id": {
      "type": "string",
      "pattern": "^sc_[A-Za-z0-9]+$"
    },
    "claim_id": {
      "type": "string",
      "pattern": "^dc_[A-Za-z0-9]+$"
    },
    "seed_domain": {
      "type": "string",
      "pattern": "^[A-Za-z0-9.-]+\\.[A-Za-z]{2,}$"
    },
    "scope_mode": {
      "const": "passive_only"
    },
    "methods": {
      "type": "array",
      "minItems": 1,
      "uniqueItems": true,
      "items": {
        "type": "string",
        "enum": [
          "dns_resolution",
          "certificate_observation",
          "subdomain_discovery",
          "http_fingerprint",
          "email_posture",
          "service_banner_observation"
        ]
      }
    },
    "exclusions": {
      "type": "array",
      "uniqueItems": true,
      "items": {
        "type": "string",
        "minLength": 1,
        "maxLength": 253
      }
    },
    "time_window": {
      "type": "object",
      "additionalProperties": false,
      "required": [
        "start",
        "end"
      ],
      "properties": {
        "start": {
          "type": "string",
          "format": "date-time"
        },
        "end": {
          "type": "string",
          "format": "date-time"
        }
      }
    },
    "jurisdiction": {
      "type": "string",
      "minLength": 2,
      "maxLength": 32
    },
    "status": {
      "type": "string",
      "enum": [
        "draft",
        "authorized",
        "approval_denied"
      ]
    }
  }
}
